{
  "version": 1,
  "revision": 2,
  "category": "equipment",
  "items": {
    "weapon_0": {
      "revision": 1,
      "category": "weapon",
      "original_name": {
        "field": "original_name",
        "value": "맨손",
        "origin": "source_exact",
        "status": "confirmed",
        "evidence": [
          {
            "file": "LORESUB.PAS",
            "line_start": 661,
            "line_end": 661
          }
        ],
        "metadata": {
          "addition": false,
          "kind": "none",
          "note": "원작 근거의 요약/값. 등장인물의 지식과 별개이다.",
          "knowledge_policy": "author_reference_not_character_knowledge"
        }
      },
      "korean_name": {
        "field": "korean_name",
        "value": "맨손",
        "origin": "source_exact",
        "status": "confirmed",
        "evidence": [
          {
            "file": "LORESUB.PAS",
            "line_start": 661,
            "line_end": 661
          }
        ],
        "metadata": {
          "addition": false,
          "kind": "none",
          "note": "원작 근거의 요약/값. 등장인물의 지식과 별개이다.",
          "knowledge_policy": "author_reference_not_character_knowledge"
        }
      },
      "claims": [
        {
          "field": "game_index",
          "value": 0,
          "origin": "source_exact",
          "status": "confirmed",
          "evidence": [
            {
              "file": "LORESUB.PAS",
              "line_start": 661,
              "line_end": 661
            }
          ],
          "metadata": {
            "addition": false,
            "kind": "none",
            "note": "원작 근거의 요약/값. 등장인물의 지식과 별개이다.",
            "knowledge_policy": "author_reference_not_character_knowledge"
          }
        },
        {
          "field": "base_weapon_power",
          "value": null,
          "origin": "unknown",
          "status": "unknown",
          "evidence": [],
          "metadata": {
            "addition": false,
            "kind": "unknown",
            "note": "원작에서 확인되지 않아 미상으로 남긴다. 수치로 추정하지 않는다.",
            "knowledge_policy": "author_reference_not_character_knowledge"
          }
        },
        {
          "field": "elemental_effect",
          "value": null,
          "origin": "unknown",
          "status": "unknown",
          "evidence": [],
          "metadata": {
            "addition": false,
            "kind": "unknown",
            "note": "원작에서 확인되지 않아 미상으로 남긴다. 수치로 추정하지 않는다.",
            "knowledge_policy": "author_reference_not_character_knowledge"
          }
        }
      ],
      "character_ids": [
        "mad_joe",
        "red_antares",
        "archimonk"
      ]
    },
    "weapon_1": {
      "revision": 1,
      "category": "weapon",
      "original_name": {
        "field": "original_name",
        "value": "단도",
        "origin": "source_exact",
        "status": "confirmed",
        "evidence": [
          {
            "file": "LORESUB.PAS",
            "line_start": 662,
            "line_end": 662
          }
        ],
        "metadata": {
          "addition": false,
          "kind": "none",
          "note": "원작 근거의 요약/값. 등장인물의 지식과 별개이다.",
          "knowledge_policy": "author_reference_not_character_knowledge"
        }
      },
      "korean_name": {
        "field": "korean_name",
        "value": "단도",
        "origin": "source_exact",
        "status": "confirmed",
        "evidence": [
          {
            "file": "LORESUB.PAS",
            "line_start": 662,
            "line_end": 662
          }
        ],
        "metadata": {
          "addition": false,
          "kind": "none",
          "note": "원작 근거의 요약/값. 등장인물의 지식과 별개이다.",
          "knowledge_policy": "author_reference_not_character_knowledge"
        }
      },
      "claims": [
        {
          "field": "game_index",
          "value": 1,
          "origin": "source_exact",
          "status": "confirmed",
          "evidence": [
            {
              "file": "LORESUB.PAS",
              "line_start": 662,
              "line_end": 662
            }
          ],
          "metadata": {
            "addition": false,
            "kind": "none",
            "note": "원작 근거의 요약/값. 등장인물의 지식과 별개이다.",
            "knowledge_policy": "author_reference_not_character_knowledge"
          }
        },
        {
          "field": "shop_price_gold",
          "value": 500,
          "origin": "source_adaptation",
          "status": "confirmed",
          "evidence": [
            {
              "file": "LORESUB.PAS",
              "line_start": 1208,
              "line_end": 1231
            }
          ],
          "metadata": {
            "addition": false,
            "kind": "none",
            "note": "원작 근거의 요약/값. 등장인물의 지식과 별개이다.",
            "knowledge_policy": "author_reference_not_character_knowledge"
          }
        },
        {
          "field": "base_weapon_power",
          "value": 5,
          "origin": "source_adaptation",
          "status": "confirmed",
          "evidence": [
            {
              "file": "LORESUB.PAS",
              "line_start": 1246,
              "line_end": 1260
            }
          ],
          "metadata": {
            "addition": false,
            "kind": "none",
            "note": "원작 근거의 요약/값. 등장인물의 지식과 별개이다.",
            "knowledge_policy": "author_reference_not_character_knowledge"
          }
        },
        {
          "field": "class_rules",
          "value": "무기상 구매 시 전투승은 사용 대상에서 제외. 기사는 기본 위력에 반올림한 50%를 가산.",
          "origin": "source_adaptation",
          "status": "confirmed",
          "evidence": [
            {
              "file": "LORESUB.PAS",
              "line_start": 1241,
              "line_end": 1260
            }
          ],
          "metadata": {
            "addition": false,
            "kind": "none",
            "note": "원작 근거의 요약/값. 등장인물의 지식과 별개이다.",
            "knowledge_policy": "author_reference_not_character_knowledge"
          }
        },
        {
          "field": "elemental_effect",
          "value": null,
          "origin": "unknown",
          "status": "unknown",
          "evidence": [],
          "metadata": {
            "addition": false,
            "kind": "unknown",
            "note": "원작에서 확인되지 않아 미상으로 남긴다. 수치로 추정하지 않는다.",
            "knowledge_policy": "author_reference_not_character_knowledge"
          }
        }
      ],
      "character_ids": [
        "spica"
      ]
    },
    "weapon_2": {
      "revision": 1,
      "category": "weapon",
      "original_name": {
        "field": "original_name",
        "value": "곤봉",
        "origin": "source_exact",
        "status": "confirmed",
        "evidence": [
          {
            "file": "LORESUB.PAS",
            "line_start": 663,
            "line_end": 663
          }
        ],
        "metadata": {
          "addition": false,
          "kind": "none",
          "note": "원작 근거의 요약/값. 등장인물의 지식과 별개이다.",
          "knowledge_policy": "author_reference_not_character_knowledge"
        }
      },
      "korean_name": {
        "field": "korean_name",
        "value": "곤봉",
        "origin": "source_exact",
        "status": "confirmed",
        "evidence": [
          {
            "file": "LORESUB.PAS",
            "line_start": 663,
            "line_end": 663
          }
        ],
        "metadata": {
          "addition": false,
          "kind": "none",
          "note": "원작 근거의 요약/값. 등장인물의 지식과 별개이다.",
          "knowledge_policy": "author_reference_not_character_knowledge"
        }
      },
      "claims": [
        {
          "field": "game_index",
          "value": 2,
          "origin": "source_exact",
          "status": "confirmed",
          "evidence": [
            {
              "file": "LORESUB.PAS",
              "line_start": 663,
              "line_end": 663
            }
          ],
          "metadata": {
            "addition": false,
            "kind": "none",
            "note": "원작 근거의 요약/값. 등장인물의 지식과 별개이다.",
            "knowledge_policy": "author_reference_not_character_knowledge"
          }
        },
        {
          "field": "shop_price_gold",
          "value": 1500,
          "origin": "source_adaptation",
          "status": "confirmed",
          "evidence": [
            {
              "file": "LORESUB.PAS",
              "line_start": 1208,
              "line_end": 1231
            }
          ],
          "metadata": {
            "addition": false,
            "kind": "none",
            "note": "원작 근거의 요약/값. 등장인물의 지식과 별개이다.",
            "knowledge_policy": "author_reference_not_character_knowledge"
          }
        },
        {
          "field": "base_weapon_power",
          "value": 7,
          "origin": "source_adaptation",
          "status": "confirmed",
          "evidence": [
            {
              "file": "LORESUB.PAS",
              "line_start": 1246,
              "line_end": 1260
            }
          ],
          "metadata": {
            "addition": false,
            "kind": "none",
            "note": "원작 근거의 요약/값. 등장인물의 지식과 별개이다.",
            "knowledge_policy": "author_reference_not_character_knowledge"
          }
        },
        {
          "field": "class_rules",
          "value": "무기상 구매 시 전투승은 사용 대상에서 제외. 기사는 기본 위력에 반올림한 50%를 가산.",
          "origin": "source_adaptation",
          "status": "confirmed",
          "evidence": [
            {
              "file": "LORESUB.PAS",
              "line_start": 1241,
              "line_end": 1260
            }
          ],
          "metadata": {
            "addition": false,
            "kind": "none",
            "note": "원작 근거의 요약/값. 등장인물의 지식과 별개이다.",
            "knowledge_policy": "author_reference_not_character_knowledge"
          }
        },
        {
          "field": "elemental_effect",
          "value": null,
          "origin": "unknown",
          "status": "unknown",
          "evidence": [],
          "metadata": {
            "addition": false,